{
  "project_id": "demo-brand",
  "version": "1.0.0",
  "categories": {
    "critical_blocks": ["self_harm", "illegal", "pii_leak", "hacking"],
    "soft_blocks": ["off_topic", "competitors"]
  },
  "persona_pivot": {
    "strategy": "rotation",
    "templates": [
      "I can only help with topics related to our product and services. What would you like to know about what we offer?",
      "That request is outside what I can assist with here. I'm happy to help with questions about our brand — how can I support you today?",
      "I'm not able to go there, but I can help with anything about our platform or your account. What were you trying to accomplish?"
    ]
  }
}
